{
  "name": "orders-api",
  "type": "service",
  "version": "0.1.0",
  "language": "Go",
  "buildpack": "docker",
  "appPath": "orders-api",
  "entrypoint": "deployment/service",
  "exposure": "intranet",
  "dependencies": [],
  "description": "Vendored unmodified from acme/orders. Serves create/get/list order. Parity reference for orders-api-next.",
  "sourceMode": "importAsIs",
  "source": {
    "repo": "acme/orders",
    "ref": "main",
    "subpath": "."
  }
}
